<?xml version="1.0" encoding="UTF-8"?>
<SignUpDetails xmlns:xs="http://www.w3.org/2001/XMLSchema-instance"
    xs:noNamespaceSchemaLocation="./xsd/signup.xsd">
    <name>ABC</name>
    <USN>2SD22CSXX</USN>
    <PhoneNo>1234567892</PhoneNo>
    <Branch>CSE</Branch>
    <Mail>abc@gmail.com</Mail>
    <password>******</password>
    <confirmPassword>******</confirmPassword>
</SignUpDetails>
